{
  "source": "events",
  "rows": [
    {
      "id": "metro_troitskaya",
      "date": "2025-09-13",
      "category": "metro_open",
      "magnitude": 1.1,
      "tau_days": 60,
      "affected_routes": [],
      "notes": "Открытие участка Троицкой линии: Вавиловская, Академическая, Крымская, ЗИЛ. +42% пасс к концу сентября, ожидается 95 тыс/день к концу года. Ни один из наших 10 трамвайных маршрутов не пересекает её (проверено по stops_routes.json), но глобально снижает нагрузку на наземный транспорт в юго-западе."
    },
    {
      "id": "bauman_campus",
      "date": "2025-09-01",
      "category": "campus_open",
      "magnitude": 1.15,
      "tau_days": 365,
      "affected_routes": [
        50
      ],
      "notes": "Открытие нового кампуса МГТУ им. Баумана: 14 зданий, 2 тыс студентов в общежитиях, научный кластер. Устойчивый рост трафика на route 50 (через Бауманскую). tau_days=365 — постоянный эффект на весь горизонт."
    },
    {
      "id": "stadium_metallurg",
      "date": "2025-09-04",
      "category": "stadium_open",
      "magnitude": 1.05,
      "tau_days": 30,
      "affected_routes": [
        50
      ],
      "notes": "После реконструкции открыт стадион 'Металлург' — домашняя арена студентов Бауманки. Событийный трафик на route 50 (домашние матчи, мероприятия)."
    },
    {
      "id": "tram_route_90",
      "date": "2025-09-15",
      "category": "new_route",
      "magnitude": 1.08,
      "tau_days": 60,
      "affected_routes": [
        12,
        25,
        28
      ],
      "notes": "Запуск трамвайного маршрута №90: Метро Сокольники → Павелецкий вокзал. ~15 тыс пасс/день за первую неделю. Перераспределяет трафик между существующими маршрутами через Сокольники (12, 25, 28)."
    },
    {
      "id": "new_stops_kalancha",
      "date": "2025-09-10",
      "category": "stops_added",
      "magnitude": 1.03,
      "tau_days": 90,
      "affected_routes": [
        7,
        11,
        12,
        13,
        25,
        37,
        50
      ],
      "notes": "Новые остановки на ул. Каланчёвская и у МЦД 'Площадь трёх вокзалов' на маршрутах 7, 13, 37, 50 (по сообщению пользователя). Мы расширили до 7 маршрутов, проходящих через эти узлы."
    },
    {
      "id": "platform_relocation",
      "date": "2025-10-11",
      "category": "stops_moved",
      "magnitude": 1.02,
      "tau_days": 60,
      "affected_routes": [
        11,
        12,
        13,
        25,
        27,
        30,
        37,
        50
      ],
      "notes": "Перенос остановок на приподнятые платформы (11.10.2025): маршруты 11, 12, 13, 23, 25, 27, 30, 32, 36, 37, 46, 50 — Бориса Галушкина, Семёновская, пр. Будённого. Из нашего списка — 11, 12, 13, 25, 27, 30, 37, 50 (route 23/32/36/46 — не наши)."
    },
    {
      "id": "mall_kraski",
      "date": "2025-10-01",
      "category": "mall_open",
      "magnitude": 1.02,
      "tau_days": 90,
      "affected_routes": [],
      "notes": "ТРЦ 'Краски' в Некрасовке (62.6 тыс м²). Не наш маршрут (Некрасовка не покрыта), но глобальный аттрактор — учитываем как noise signal."
    },
    {
      "id": "polyclinics_reopen",
      "date": "2025-10-15",
      "category": "clinics_open",
      "magnitude": 1.01,
      "tau_days": 60,
      "affected_routes": [],
      "notes": "После реконструкции открыты 15 поликлиник (Дорогомилово, Красносельский, Москворечье-Сабурово). Локальное увеличение трафика, нет точного маппинга на наши маршруты."
    }
  ],
  "rows_count": 8,
  "generated_at": "2026-09-27T20:02:34+00:00",
  "inputs": [
    {
      "path": "data/external/events_moscow.json",
      "sha256": "6ebd132811ad5a6e6d9a77a50c84d9222cccdd6a3167da0950fd3a675d6078dd",
      "rows": 8
    }
  ]
}